{
    "dataset": "GEFCom2012",
    "task": "forecasting",
    "non_iidness": 0.5,
    "test_set_fraction": 0.2,
    "num_clients": 2,
    "aggregation_model": {
        "type": "FedAvg",
        "params": {}
    },
    "learning_algorithm": "GEFCom2012LSTM",
    "optimizer": {
        "type": "Adam",
        "params": {
            "beta_1": 0.9,
            "beta_2": 0.99,
            "weight_decay": 0.0
        }
    },
    "learning_rate": 0.0001,
    "epochs_per_round": 2,
    "batch_size": 1024,
    "loss_function": "MSE",
    "num_rounds": 10,
    "evaluation_metrics": [
        "Loss",
        "RMSE"
    ]
}